{
  "contractId": "spts.flow-task-packet",
  "schemaVersion": "2.0.0",
  "packetId": "packet-flow",
  "packetDigest": "0000000000000000000000000000000000000000000000000000000000000000",
  "issuedAt": "2026-08-30T23:09:25.000Z",
  "task": { "projectId": "SPTS", "taskId": "SPTS-10", "sliceId": "S2" },
  "repository": {
    "repositoryId": "scrum-pi-team-skills",
    "rootId": "repo-root",
    "baseBranch": "main",
    "headBranch": "feature/spts-10",
    "baseCommit": "aaaaaaaaaaaaaaaaaaaaaaaaaaaaaaaaaaaaaaaa",
    "baseTree": "bbbbbbbbbbbbbbbbbbbbbbbbbbbbbbbbbbbbbbbb",
    "candidateCommit": "cccccccccccccccccccccccccccccccccccccccc",
    "candidateTree": "dddddddddddddddddddddddddddddddddddddddd"
  },
  "run": { "runId": "run-2" },
  "subject": {
    "role": "flow",
    "actorId": "flow-1",
    "executionId": "exec-flow",
    "workspaceId": "workspace-flow",
    "access": "orchestrate"
  },
  "assurance": { "profile": "standard", "phase": "verification" },
  "authorityDigest": "aaaaaaaaaaaaaaaaaaaaaaaaaaaaaaaaaaaaaaaaaaaaaaaaaaaaaaaaaaaaaaaa",
  "controllerStateDigest": "bbbbbbbbbbbbbbbbbbbbbbbbbbbbbbbbbbbbbbbbbbbbbbbbbbbbbbbbbbbbbbbb",
  "work": {
    "objective": "Review the Slice 2 protocol.",
    "acceptanceCriteria": ["Boundaries are closed."],
    "allowedPaths": ["packages/contracts/"],
    "outOfScope": [],
    "resources": {
      "skills": ["skill-flow"],
      "promptTemplates": ["prompt-flow"]
    }
  }
}
